{
  "name": "test_json_jq_transform_wf",
  "version": 1,
  "tasks": [
    {
      "name": "jq",
      "taskReferenceName": "jq_1",
      "inputParameters": {
        "input": "${workflow.input}",
        "queryExpression": ".input as $_ | { out: ($_.in1.array + $_.in2.array) }"
      },
      "type": "JSON_JQ_TRANSFORM",
      "decisionCases": {},
      "defaultCase": [],
      "forkTasks": [],
      "startDelay": 0,
      "joinOn": [],
      "optional": false,
      "defaultExclusiveJoinTask": [],
      "asyncComplete": false,
      "loopOver": []
    }
  ],
  "inputParameters": [],
  "outputParameters": {},
  "schemaVersion": 2,
  "restartable": true,
  "workflowStatusListenerEnabled": false,
  "timeoutPolicy": "ALERT_ONLY",
  "timeoutSeconds": 0,
  "ownerEmail": "test@harness.com"
}
