{
  "name": "hello_workflow",
  "version": 1,
  "tasks": [
    {
      "name": "fetch_data",
      "taskReferenceName": "fetch_ref",
      "type": "HTTP",
      "inputParameters": {
        "http_request": {
          "uri": "https://orkes-api-tester.orkesagentmesh.com/api",
          "method": "GET"
        }
      }
    },
    {
      "name": "parse_response",
      "taskReferenceName": "parse_ref",
      "type": "INLINE",
      "inputParameters": {
        "data": "${fetch_ref.output.response.body}",
        "evaluatorType": "graaljs",
        "expression": "(function() { var d = $.data; return { summary: 'Host ' + d.hostName + ' responded in ' + d.apiRandomDelay + ' with random value ' + d.randomInt, host: d.hostName, randomValue: d.randomInt }; })()"
      }
    }
  ],
  "outputParameters": {
    "summary": "${parse_ref.output.result.summary}",
    "apiResponse": "${fetch_ref.output.response.body}"
  },
  "schemaVersion": 2,
  "ownerEmail": "dev@example.com"
}
